{
  "schema_version": "1.0",
  "exported_at": "2026-09-19T09:00:00Z",
  "synthetic": true,
  "redaction_version": "fixture-v1",
  "task": {
    "task_id": "task-hello",
    "goal_original": "Merhaba dosyasını oluştur ve içeriğini doğrula.",
    "goal_normalized": "Create and verify the hello file.",
    "success_criteria": [
      "Exact hello content followed by a newline"
    ]
  },
  "run": {
    "run_id": "run-hello",
    "status": "succeeded",
    "outcome": "passed",
    "policy_version": "policy-v001",
    "deployment_ids": [
      "decider-base-example"
    ],
    "environment": {
      "kind": "synthetic fixture",
      "real_execution": false
    }
  },
  "steps": [
    {
      "snapshots": [
        {
          "snapshot_id": "snapshot-0",
          "state_version": 0,
          "state": "Goal: create /workspace/hello.txt with Hello from the local agent. followed by a newline. File is absent. Workspace writes are authorized."
        }
      ],
      "decisions": [
        {
          "decision_id": "decision-0",
          "snapshot_id": "snapshot-0",
          "question": "What is the next action?",
          "options": [
            {
              "id": "write_file",
              "label": "Write the authorized file"
            },
            {
              "id": "ask_supervisor",
              "label": "Ask the supervisor"
            }
          ],
          "selected_option": "write_file",
          "probabilities": {
            "write_file": 0.96,
            "ask_supervisor": 0.04
          },
          "policy_result": "allow"
        }
      ],
      "actions": [
        {
          "action_id": "action-0",
          "decision_id": "decision-0",
          "tool": "filesystem.write",
          "arguments": {
            "path": "/workspace/hello.txt",
            "content": "Hello from the local agent.\n"
          },
          "idempotency_key": "hello-write-0",
          "status": "ok",
          "actual_option": "write_file"
        }
      ],
      "observations": [
        {
          "observation_id": "observation-0",
          "action_id": "action-0",
          "kind": "filesystem.read",
          "summary": "Hello from the local agent.\n"
        }
      ],
      "verifications": [
        {
          "verification_id": "verify-0",
          "action_id": "action-0",
          "criterion": "Exact file content",
          "method": "independent_read_equals",
          "result": "passed",
          "expected": "Hello from the local agent.\n",
          "actual": "Hello from the local agent.\n",
          "evidence_refs": [
            "observation-0"
          ]
        }
      ],
      "escalations": [],
      "human_interventions": [
        {
          "intervention_id": "synthetic-approval-event",
          "kind": "approve",
          "summary": "Synthetic approval example; not a real user intervention."
        }
      ],
      "model_calls": [
        {
          "call_id": "call-0",
          "deployment_id": "decider-base-example",
          "role": "system1",
          "status": "ok",
          "latency_ms": null
        }
      ],
      "artifacts": [],
      "labels": [
        {
          "label_id": "label-0",
          "verification_ref": "verify-0",
          "source": "verified_outcome",
          "summary": "write_file is correct"
        }
      ],
      "step_id": "step-0",
      "ordinal": 0
    }
  ]
}
